[
  {
    "id": "sonic_warrior_bit_schneider",
    "slug": "bit-schneider",
    "name": "Bit Schneider",
    "faction": "Sonic",
    "type": "Warrior",
    "spiritCost": 1,
    "costResource": "Spirit",
    "attack": 1900,
    "health": 6500,
    "imageFile": "Bit Schneider.png",
    "rarity": "Beta",
    "deckTags": [
      "Sonic"
    ]
  },
  {
    "id": "sonic_warrior_brut",
    "slug": "brut",
    "name": "Brut",
    "faction": "Sonic",
    "type": "Warrior",
    "spiritCost": 3,
    "costResource": "Spirit",
    "attack": 3000,
    "health": 5500,
    "imageFile": "Brut.png",
    "rarity": "Beta",
    "deckTags": [
      "Sonic"
    ]
  },
  {
    "id": "sonic_warrior_carlson",
    "slug": "carlson",
    "name": "Carlson",
    "faction": "Sonic",
    "type": "Warrior",
    "spiritCost": 1,
    "costResource": "Spirit",
    "attack": 1900,
    "health": 6000,
    "imageFile": "Carlson.png",
    "rarity": "Beta",
    "deckTags": [
      "Sonic"
    ]
  },
  {
    "id": "sonic_warrior_cassidy_sinclair",
    "slug": "cassidy-sinclair",
    "name": "Cassidy Sinclair",
    "faction": "Sonic",
    "type": "Warrior",
    "spiritCost": 1,
    "costResource": "Spirit",
    "attack": 1950,
    "health": 6500,
    "imageFile": "Cassidy Sinclair.png",
    "rarity": "Beta",
    "deckTags": [
      "Sonic"
    ]
  },
  {
    "id": "sonic_warrior_high_councilor_jerome_baldwin",
    "slug": "high-councilor-jerome-baldwin",
    "name": "High Councilor Jerome Baldwin",
    "faction": "Sonic",
    "type": "Warrior",
    "spiritCost": 1,
    "costResource": "Spirit",
    "attack": 1700,
    "health": 10000,
    "imageFile": "High Councilor Jerome Baldwin.png",
    "rarity": "Beta",
    "deckTags": [
      "Sonic"
    ]
  },
  {
    "id": "sonic_warrior_kit",
    "slug": "kit",
    "name": "Kit",
    "faction": "Sonic",
    "type": "Warrior",
    "spiritCost": 1,
    "costResource": "Spirit",
    "attack": 1800,
    "health": 6500,
    "imageFile": "Kit.png",
    "rarity": "Beta",
    "deckTags": [
      "Sonic"
    ]
  },
  {
    "id": "sonic_warrior_lynn_katabatic",
    "slug": "lynn-katabatic",
    "name": "Lynn Katabatic",
    "faction": "Sonic",
    "type": "Warrior",
    "spiritCost": 1,
    "costResource": "Spirit",
    "attack": 2200,
    "health": 5500,
    "imageFile": "Lynn Katabatic.png",
    "rarity": "Beta",
    "deckTags": [
      "Sonic"
    ]
  },
  {
    "id": "sonic_warrior_priest_aquinas",
    "slug": "priest-aquinas",
    "name": "Priest Aquinas",
    "faction": "Sonic",
    "type": "Warrior",
    "spiritCost": 1,
    "costResource": "Spirit",
    "attack": 2000,
    "health": 5500,
    "imageFile": "Priest Aquinas.png",
    "rarity": "Beta",
    "deckTags": [
      "Sonic"
    ]
  },
  {
    "id": "sonic_warrior_raigi",
    "slug": "raigi",
    "name": "Raigi",
    "faction": "Sonic",
    "type": "Warrior",
    "spiritCost": 3,
    "costResource": "Spirit",
    "attack": 2650,
    "health": 5000,
    "imageFile": "Raigi.png",
    "rarity": "Beta",
    "deckTags": [
      "Sonic"
    ]
  },
  {
    "id": "sonic_warrior_sunourufu",
    "slug": "sunourufu",
    "name": "Sunōurufu",
    "faction": "Sonic",
    "type": "Warrior",
    "spiritCost": 2,
    "costResource": "Spirit",
    "attack": 2350,
    "health": 6000,
    "imageFile": "Sunōurufu.png",
    "rarity": "Beta",
    "deckTags": [
      "Sonic"
    ]
  },
  {
    "id": "sonic_warrior_titus",
    "slug": "titus",
    "name": "Titus",
    "faction": "Sonic",
    "type": "Warrior",
    "spiritCost": 3,
    "costResource": "Spirit",
    "attack": 2800,
    "health": 6000,
    "imageFile": "Titus.png",
    "rarity": "Beta",
    "deckTags": [
      "Sonic"
    ]
  },
  {
    "id": "sonic_warrior_tristin_dangan",
    "slug": "tristin-dangan",
    "name": "Tristin Dangan",
    "faction": "Sonic",
    "type": "Warrior",
    "spiritCost": 1,
    "costResource": "Spirit",
    "attack": 1900,
    "health": 5500,
    "imageFile": "Tristin Dangan.png",
    "rarity": "Beta",
    "deckTags": [
      "Sonic"
    ]
  },
  {
    "id": "sonic_warrior_warden_babylon",
    "slug": "warden-babylon",
    "name": "Warden Babylon",
    "faction": "Sonic",
    "type": "Warrior",
    "spiritCost": 2,
    "costResource": "Spirit",
    "attack": 2500,
    "health": 6100,
    "imageFile": "Warden Babylon.png",
    "rarity": "Beta",
    "deckTags": [
      "Sonic"
    ]
  },
  {
    "id": "sonic_warrior_yojimbo",
    "slug": "yojimbo",
    "name": "Yojimbo",
    "faction": "Sonic",
    "type": "Warrior",
    "spiritCost": 3,
    "costResource": "Spirit",
    "attack": 2750,
    "health": 6500,
    "imageFile": "Yojimbo.png",
    "rarity": "Beta",
    "deckTags": [
      "Sonic"
    ]
  },
  {
    "id": "surfer_warrior_alluvium",
    "slug": "alluvium",
    "name": "Alluvium",
    "faction": "Surfer",
    "type": "Warrior",
    "spiritCost": 1,
    "costResource": "Spirit",
    "attack": 2100,
    "health": 6250,
    "imageFile": "Alluvium.png",
    "rarity": "Beta",
    "deckTags": [
      "Surfer"
    ]
  },
  {
    "id": "surfer_warrior_aur_neolin",
    "slug": "aur-neolin",
    "name": "Aur Neolin",
    "faction": "Surfer",
    "type": "Warrior",
    "spiritCost": 1,
    "costResource": "Spirit",
    "attack": 1900,
    "health": 5500,
    "imageFile": "Aur Neolin.png",
    "rarity": "Beta",
    "deckTags": [
      "Surfer"
    ]
  },
  {
    "id": "surfer_warrior_captain_cold_rain_kai",
    "slug": "captain-cold-rain-kai",
    "name": "Captain “Cold Rain” Kai",
    "faction": "Surfer",
    "type": "Warrior",
    "spiritCost": 2,
    "costResource": "Spirit",
    "attack": 2400,
    "health": 6500,
    "imageFile": "Captain “Cold Rain” Kai.png",
    "rarity": "Beta",
    "deckTags": [
      "Surfer"
    ]
  },
  {
    "id": "surfer_warrior_chiup_flowiktu",
    "slug": "chiup-flowiktu",
    "name": "Chiup Flowiktu",
    "faction": "Surfer",
    "type": "Warrior",
    "spiritCost": 1,
    "costResource": "Spirit",
    "attack": 2000,
    "health": 5800,
    "imageFile": "Chiup Flowiktu.png",
    "rarity": "Beta",
    "deckTags": [
      "Surfer"
    ]
  },
  {
    "id": "surfer_warrior_countess_kalix",
    "slug": "countess-kalix",
    "name": "Countess Kalix",
    "faction": "Surfer",
    "type": "Warrior",
    "spiritCost": 2,
    "costResource": "Spirit",
    "attack": 2300,
    "health": 5000,
    "imageFile": "Countess Kalix.png",
    "rarity": "Beta",
    "deckTags": [
      "Surfer"
    ]
  },
  {
    "id": "surfer_warrior_delta_renvatten",
    "slug": "delta-renvatten",
    "name": "Delta Renvatten",
    "faction": "Surfer",
    "type": "Warrior",
    "spiritCost": 2,
    "costResource": "Spirit",
    "attack": 2500,
    "health": 7000,
    "imageFile": "Delta Renvatten.png",
    "rarity": "Beta",
    "deckTags": [
      "Surfer"
    ]
  },
  {
    "id": "surfer_warrior_fen_larkin",
    "slug": "fen-larkin",
    "name": "Fen Larkin",
    "faction": "Surfer",
    "type": "Warrior",
    "spiritCost": 1,
    "costResource": "Spirit",
    "attack": 2200,
    "health": 5500,
    "imageFile": "Fen Larkin.png",
    "rarity": "Beta",
    "deckTags": [
      "Surfer"
    ]
  },
  {
    "id": "surfer_warrior_freia_renvatten",
    "slug": "freia-renvatten",
    "name": "Freia Renvatten",
    "faction": "Surfer",
    "type": "Warrior",
    "spiritCost": 1,
    "costResource": "Spirit",
    "attack": 1850,
    "health": 10000,
    "imageFile": "Freia Renvatten.png",
    "rarity": "Beta",
    "deckTags": [
      "Surfer"
    ]
  },
  {
    "id": "surfer_warrior_haito",
    "slug": "haito",
    "name": "Haito",
    "faction": "Surfer",
    "type": "Warrior",
    "spiritCost": 1,
    "costResource": "Spirit",
    "attack": 2000,
    "health": 6500,
    "imageFile": "Haito.png",
    "rarity": "Beta",
    "deckTags": [
      "Surfer"
    ]
  },
  {
    "id": "surfer_warrior_kade_ritz",
    "slug": "kade-ritz",
    "name": "Kade Ritz",
    "faction": "Surfer",
    "type": "Warrior",
    "spiritCost": 2,
    "costResource": "Spirit",
    "attack": 2450,
    "health": 6300,
    "imageFile": "Kade Ritz.png",
    "rarity": "Beta",
    "deckTags": [
      "Surfer"
    ]
  },
  {
    "id": "surfer_warrior_kaltvatten",
    "slug": "kaltvatten",
    "name": "Kaltvatten",
    "faction": "Surfer",
    "type": "Warrior",
    "spiritCost": 3,
    "costResource": "Spirit",
    "attack": 3000,
    "health": 6500,
    "imageFile": "Kaltvatten.png",
    "rarity": "Beta",
    "deckTags": [
      "Surfer"
    ]
  },
  {
    "id": "surfer_warrior_mark_lee_fathom",
    "slug": "mark-lee-fathom",
    "name": "Mark Lee Fathom",
    "faction": "Surfer",
    "type": "Warrior",
    "spiritCost": 2,
    "costResource": "Spirit",
    "attack": 2400,
    "health": 6500,
    "imageFile": "Mark Lee Fathom.png",
    "rarity": "Beta",
    "deckTags": [
      "Surfer"
    ]
  },
  {
    "id": "surfer_warrior_okee",
    "slug": "okee",
    "name": "Okee",
    "faction": "Surfer",
    "type": "Warrior",
    "spiritCost": 3,
    "costResource": "Spirit",
    "attack": 2700,
    "health": 6000,
    "imageFile": "Okee.png",
    "rarity": "Beta",
    "deckTags": [
      "Surfer"
    ]
  },
  {
    "id": "surfer_warrior_pandora_the_island_eater",
    "slug": "pandora-the-island-eater",
    "name": "Pandora the Island Eater",
    "faction": "Surfer",
    "type": "Warrior",
    "spiritCost": 1,
    "costResource": "Spirit",
    "attack": 2000,
    "health": 6300,
    "imageFile": "Pandora the Island Eater.png",
    "rarity": "Beta",
    "deckTags": [
      "Surfer"
    ]
  },
  {
    "id": "warrior_aaron_alacapati",
    "slug": "aaron-alacapati",
    "name": "Aaron Alacapati",
    "faction": "Dwarf",
    "type": "Warrior",
    "spiritCost": 2,
    "costResource": "Spirit",
    "attack": 2500,
    "health": 6500,
    "imageFile": "Aaron Alacapati.png",
    "rarity": "Beta",
    "deckTags": [
      "Dwarf"
    ]
  },
  {
    "id": "warrior_ajax",
    "slug": "ajax",
    "name": "Ajax",
    "faction": "Dwarf",